{"canonical_writes":0,"claim_class":"derived_result","claim_id":"sha256:22cb62385b1900bf80d5abadf7ad5f70e3ac26ba5522a7058a26b4141666c1c8","claim_status":"supported","created_utc":"2026-07-28T00:00:00Z","epistemic_source":"derivation","grants_authority":false,"schema_version":"ScientificClaim/v1","statement":{"object":"by-construction","predicate":"is-positive-definite","subject":"synthetic-spd-3x3"},"support_refs":["sha256:fe6c13ab329c93f2f167189ac711bac79d7bf62151c7ec91d333bd6ef1655f69"]}
