{"canonical_writes":0,"claim_class":"candidate_hypothesis","claim_id":"sha256:979de304a43e96115b2e5abac0695f0169652563b6103e1838448739aebe41ce","claim_status":"under_investigation","created_utc":"2026-07-28T00:00:00Z","epistemic_source":"operator","grants_authority":false,"schema_version":"ScientificClaim/v1","statement":{"object":"one-dimensional-cycle","predicate":"topology","subject":"synthetic-circle-cloud"},"support_refs":[]}
