{"canonical_writes":0,"claim_class":"candidate_hypothesis","claim_id":"sha256:52c64e1c74b4f0ceaaba96f59e34c6ef65f7cbb2da56afec5e0d74b068867365","claim_status":"proposed","created_utc":"2026-07-28T00:00:00Z","epistemic_source":"operator","grants_authority":false,"schema_version":"ScientificClaim/v1","statement":{"object":"under-null-model","predicate":"has-zero-mean","subject":"synthetic-noise-series"},"support_refs":[]}
