{"canonical_writes":0,"claim_class":"empirical_observation","claim_id":"sha256:998730e2755a6df24716cedc66a9718d4298da55ceabb761e83c2e5be29f850c","claim_status":"inconclusive","created_utc":"2026-07-28T00:00:00Z","epistemic_source":"experiment","grants_authority":false,"schema_version":"ScientificClaim/v1","statement":{"object":"midpoint","predicate":"mean-shift-at","subject":"synthetic-regime-series"},"support_refs":["sha256:2b00f762ad7df8233e9411455188dd8e957f59480e15814115b4128c576515d9"]}
