{"canonical_writes":0,"claim_class":"empirical_observation","claim_id":"sha256:d366c6e50b4bc8a028b75056db1c7562693eac4d3cdba15763717c6b67b0539a","claim_status":"supported","created_utc":"2026-07-28T00:00:00Z","epistemic_source":"experiment","grants_authority":false,"schema_version":"ScientificClaim/v1","statement":{"object":"positive","predicate":"slope","subject":"synthetic-trend-series"},"support_refs":["sha256:b80763c3d14f41e6e0e5048dc5ab9ef9125a7a1e63b02ce4768aa354b97efecf"]}
