{"canonical_writes":0,"claim_class":"candidate_hypothesis","claim_id":"sha256:f6de14329196bea1776c153545cd97d5264cc2d80b73ad26378965d034247904","claim_status":"proposed","created_utc":"2026-07-28T00:00:00Z","epistemic_source":"operator","grants_authority":false,"schema_version":"ScientificClaim/v1","statement":{"object":"two","predicate":"has-cluster-count","subject":"synthetic-two-cluster-cloud"},"support_refs":[]}
